id,created_at,text,favorites,retweets,entities,language
822446982648201216,2017-01-20 14:13:35,"I'm still asking you to believe - not in my ability to bring about change, but in yours. I believe in change because I believe in you.",767000,306102,"{'hashtags': [], 'symbols': [], 'user_mentions': [], 'urls': []}",en
822446334787600385,2017-01-20 14:11:01,"As we look forward, I want our first steps to reflect what matters most to you. Share your thoughts with me at https://t.co/fGUxlpLVue.",198222,51914,"{'hashtags': [], 'symbols': [], 'user_mentions': [], 'urls': [{'url': 'https://t.co/fGUxlpLVue', 'expanded_url': 'http://Obama.org', 'display_url': 'Obama.org', 'indices': [111, 134]}]}",en
822446040729157632,2017-01-20 14:09:51,"I won't stop; I'll be right there with you as a citizen, inspired by your voices of truth and justice, good humor, and love.",561896,190582,"{'hashtags': [], 'symbols': [], 'user_mentions': [], 'urls': []}",en
822445882247413761,2017-01-20 14:09:13,It's been the honor of my life to serve you. You made me a better leader and a better man.,1503847,550902,"{'hashtags': [], 'symbols': [], 'user_mentions': [], 'urls': []}",en
822181779217981441,2017-01-19 20:39:46,"Proud to make this one of my final actions as President. America is a nation of second chances, and 1,715 people de… https://t.co/vZLJa9SweM",213508,60533,"{'hashtags': [], 'symbols': [], 'user_mentions': [], 'urls': [{'url': 'https://t.co/vZLJa9SweM', 'expanded_url': 'https://twitter.com/i/web/status/822181779217981441', 'display_url': 'twitter.com/i/web/status/8…', 'indices': [117, 140]}]}",en
821879923602325504,2017-01-19 00:40:18,"RT @FLOTUS: Being your First Lady has been the honor of a lifetime. From the bottom of my heart, thank you. -mo https://t.co/pahEydkZ5Z",0,320349,"{'hashtags': [], 'symbols': [], 'user_mentions': [{'screen_name': 'FLOTUS', 'name': 'Melania Trump', 'id': 818876014390603776, 'id_str': '818876014390603776', 'indices': [3, 10]}], 'urls': [], 'media': [{'id': 821872640960839681, 'id_str': '821872640960839681', 'indices': [112, 135], 'media_url': 'http://pbs.twimg.com/media/C2fgz_8VQAEExHY.jpg', 'media_url_https': 'https://pbs.twimg.com/media/C2fgz_8VQAEExHY.jpg', 'url': 'https://t.co/pahEydkZ5Z', 'display_url': 'pic.twitter.com/pahEydkZ5Z', 'expanded_url': 'https://twitter.com/FLOTUS/status/821872910373715969/photo/1', 'type': 'photo', 'sizes': {'thumb': {'w': 150, 'h': 150, 'resize': 'crop'}, 'small': {'w': 680, 'h': 453, 'resize': 'fit'}, 'large': {'w': 2000, 'h': 1333, 'resize': 'fit'}, 'medium': {'w': 1200, 'h': 800, 'resize': 'fit'}}, 'source_status_id': 821872910373715969, 'source_status_id_str': '821872910373715969', 'source_user_id': 1093090866, 'source_user_id_str': '1093090866'}]}",en
821371347012087808,2017-01-17 14:59:24,"To the girl from the South Side who took on a role she didn't ask for and made it her own: Happy Birthday, Michelle… https://t.co/cFWec1RQN0",1089706,307016,"{'hashtags': [], 'symbols': [], 'user_mentions': [], 'urls': [{'url': 'https://t.co/cFWec1RQN0', 'expanded_url': 'https://twitter.com/i/web/status/821371347012087808', 'display_url': 'twitter.com/i/web/status/8…', 'indices': [117, 140]}]}",en
821147626422800386,2017-01-17 00:10:24,"From one 44 to another, thanks for finally giving @FLOTUS and generations of hopeful fans a @Cubs championship. https://t.co/RnLyTYF2ub",88241,15407,"{'hashtags': [], 'symbols': [], 'user_mentions': [{'screen_name': 'FLOTUS', 'name': 'Melania Trump', 'id': 818876014390603776, 'id_str': '818876014390603776', 'indices': [50, 57]}, {'screen_name': 'Cubs', 'name': 'Chicago Cubs', 'id': 41144996, 'id_str': '41144996', 'indices': [92, 97]}], 'urls': [], 'media': [{'id': 821147586128007168, 'id_str': '821147586128007168', 'indices': [112, 135], 'media_url': 'http://pbs.twimg.com/media/C2VNYQNUUAAHpoZ.jpg', 'media_url_https': 'https://pbs.twimg.com/media/C2VNYQNUUAAHpoZ.jpg', 'url': 'https://t.co/RnLyTYF2ub', 'display_url': 'pic.twitter.com/RnLyTYF2ub', 'expanded_url': 'https://twitter.com/POTUS/status/821147626422800386/photo/1', 'type': 'photo', 'sizes': {'small': {'w': 680, 'h': 453, 'resize': 'fit'}, 'thumb': {'w': 150, 'h': 150, 'resize': 'crop'}, 'large': {'w': 2000, 'h': 1333, 'resize': 'fit'}, 'medium': {'w': 1200, 'h': 800, 'resize': 'fit'}}}]}",en
821082223910780928,2017-01-16 19:50:31,"In honor of their legacy, @FLOTUS and I are joining Americans across the country in a day of service to our community here in D.C. #MLKDay",62875,10309,"{'hashtags': [{'text': 'MLKDay', 'indices': [131, 138]}], 'symbols': [], 'user_mentions': [{'screen_name': 'FLOTUS', 'name': 'Melania Trump', 'id': 818876014390603776, 'id_str': '818876014390603776', 'indices': [26, 33]}], 'urls': []}",en
821081947728412672,2017-01-16 19:49:25,"Dr. King and those who marched with him proved that people who love their country can change it. As Americans, we all owe them a great deal.",198972,61752,"{'hashtags': [], 'symbols': [], 'user_mentions': [], 'urls': []}",en
819694728665006080,2017-01-12 23:57:07,"That is out of this world. Thanks, @NASA. https://t.co/R8CSjAwt2E",164401,40484,"{'hashtags': [], 'symbols': [], 'user_mentions': [{'screen_name': 'NASA', 'name': 'NASA', 'id': 11348282, 'id_str': '11348282', 'indices': [35, 40]}], 'urls': [{'url': 'https://t.co/R8CSjAwt2E', 'expanded_url': 'https://twitter.com/marscuriosity/status/819597980596473856', 'display_url': 'twitter.com/marscuriosity/…', 'indices': [42, 65]}]}",en
819044196371800065,2017-01-11 04:52:08,"Thank you for everything. My last ask is the same as my first. I'm asking you to believe—not in my ability to create change, but in yours.",1682568,763782,"{'hashtags': [], 'symbols': [], 'user_mentions': [], 'urls': []}",en
815603723707658241,2017-01-01 17:00:55,It’s been the privilege of my life to serve as your President. I look forward to standing with you as a citizen. Happy New Year everybody.,780310,228127,"{'hashtags': [], 'symbols': [], 'user_mentions': [], 'urls': []}",en
815603416089194496,2017-01-01 16:59:42,"From realizing marriage equality to removing barriers to opportunity, we've made history in our work to reaffirm that all are created equal.",187055,46752,"{'hashtags': [], 'symbols': [], 'user_mentions': [], 'urls': []}",en
815601969154899969,2017-01-01 16:53:57,We brought home more of our troops &amp; strengthened U.S. leadership—leading with diplomacy &amp; partnering with nations to meet global problems.,71091,15724,"{'hashtags': [], 'symbols': [], 'user_mentions': [], 'urls': []}",en
815601640124387328,2017-01-01 16:52:38,"We traded foreign oil for clean energy, we doubled fuel efficiency standards, &amp; we acted on a global scale to save… https://t.co/U2n4myQUkV",61762,16988,"{'hashtags': [], 'symbols': [], 'user_mentions': [], 'urls': [{'url': 'https://t.co/U2n4myQUkV', 'expanded_url': 'https://twitter.com/i/web/status/815601640124387328', 'display_url': 'twitter.com/i/web/status/8…', 'indices': [120, 143]}]}",en
815601279716225024,2017-01-01 16:51:12,"After decades of rising health care costs, today nearly every American now has access to the financial security of… https://t.co/P9VEPIE3Ab",54493,15404,"{'hashtags': [], 'symbols': [], 'user_mentions': [], 'urls': [{'url': 'https://t.co/P9VEPIE3Ab', 'expanded_url': 'https://twitter.com/i/web/status/815601279716225024', 'display_url': 'twitter.com/i/web/status/8…', 'indices': [116, 139]}]}",en
815600798558208001,2017-01-01 16:49:18,"Facing the worst financial crisis in 80 years, you delivered the longest streak of job growth in our history. https://t.co/Vk3PfRgZqF",73159,23305,"{'hashtags': [], 'symbols': [], 'user_mentions': [], 'urls': [], 'media': [{'id': 815600782565371904, 'id_str': '815600782565371904', 'indices': [110, 133], 'media_url': 'http://pbs.twimg.com/media/C1GYlytW8AAg3YE.jpg', 'media_url_https': 'https://pbs.twimg.com/media/C1GYlytW8AAg3YE.jpg', 'url': 'https://t.co/Vk3PfRgZqF', 'display_url': 'pic.twitter.com/Vk3PfRgZqF', 'expanded_url': 'https://twitter.com/POTUS/status/815600798558208001/photo/1', 'type': 'photo', 'sizes': {'thumb': {'w': 150, 'h': 150, 'resize': 'crop'}, 'large': {'w': 1280, 'h': 720, 'resize': 'fit'}, 'small': {'w': 680, 'h': 383, 'resize': 'fit'}, 'medium': {'w': 1200, 'h': 675, 'resize': 'fit'}}}]}",en
815600521688055808,2017-01-01 16:48:12,"As we look ahead to the future, I wanted to take a moment to look back on the remarkable progress that you made possible these past 8 years.",205975,44572,"{'hashtags': [], 'symbols': [], 'user_mentions': [], 'urls': []}",en
813059340013895680,2016-12-25 16:30:27,"The best part of the holidays is the time we share with those we love. On behalf of Michelle, Malia, and Sasha, Mer… https://t.co/AOai9bJYlg",379303,97725,"{'hashtags': [], 'symbols': [], 'user_mentions': [], 'urls': [{'url': 'https://t.co/AOai9bJYlg', 'expanded_url': 'https://twitter.com/i/web/status/813059340013895680', 'display_url': 'twitter.com/i/web/status/8…', 'indices': [117, 140]}]}",en
811329368408621056,2016-12-20 21:56:09,A ban on drilling in Arctic waters helps protect the planet we share. Proud to take this step with @JustinTrudeau &amp;… https://t.co/cDbN6inXRy,81951,24535,"{'hashtags': [], 'symbols': [], 'user_mentions': [{'screen_name': 'JustinTrudeau', 'name': 'Justin Trudeau', 'id': 14260960, 'id_str': '14260960', 'indices': [99, 113]}], 'urls': [{'url': 'https://t.co/cDbN6inXRy', 'expanded_url': 'https://twitter.com/i/web/status/811329368408621056', 'display_url': 'twitter.com/i/web/status/8…', 'indices': [121, 144]}]}",en
809899303321866240,2016-12-16 23:13:35,"The Justice for All bill is a bipartisan step in making our criminal justice system fairer, smarter, and more effective. Proud to sign it.",34527,5932,"{'hashtags': [], 'symbols': [], 'user_mentions': [], 'urls': []}",en
809805411129946115,2016-12-16 17:00:30,"The suits said it all – colorful, fun, a little outlandish. That’s what sports should be. Thanks, Craig Sager.  We'll all miss you.",48006,10141,"{'hashtags': [], 'symbols': [], 'user_mentions': [], 'urls': []}",en
808807755456937984,2016-12-13 22:56:10,"In signing the Cures Act into law, we're one step closer to breakthroughs on the greatest health challenges of our… https://t.co/LhyahsK0sJ",47804,10304,"{'hashtags': [], 'symbols': [], 'user_mentions': [], 'urls': [{'url': 'https://t.co/LhyahsK0sJ', 'expanded_url': 'https://twitter.com/i/web/status/808807755456937984', 'display_url': 'twitter.com/i/web/status/8…', 'indices': [116, 139]}]}",en
808510710770761728,2016-12-13 03:15:49,Great to see so many investors come together to work towards a clean energy future. It's a smart investment and it'… https://t.co/aqGx2t7QAZ,45278,11329,"{'hashtags': [], 'symbols': [], 'user_mentions': [], 'urls': [{'url': 'https://t.co/aqGx2t7QAZ', 'expanded_url': 'https://twitter.com/i/web/status/808510710770761728', 'display_url': 'twitter.com/i/web/status/8…', 'indices': [117, 140]}]}",en
805906134074847232,2016-12-05 22:46:10,"Proud of our Champions of Change - folks who prove that, here in America, there's no more powerful role than that o… https://t.co/wbz1YSlUEx",45805,8946,"{'hashtags': [], 'symbols': [], 'user_mentions': [], 'urls': [{'url': 'https://t.co/wbz1YSlUEx', 'expanded_url': 'https://twitter.com/i/web/status/805906134074847232', 'display_url': 'twitter.com/i/web/status/8…', 'indices': [117, 140]}]}",en
804353679050543104,2016-12-01 15:57:15,"Today, we honor those who are leading the fight against HIV/AIDS. Because of them, an AIDS-free generation is now w… https://t.co/yW9uyfbf1x",97860,28961,"{'hashtags': [], 'symbols': [], 'user_mentions': [], 'urls': [{'url': 'https://t.co/yW9uyfbf1x', 'expanded_url': 'https://twitter.com/i/web/status/804353679050543104', 'display_url': 'twitter.com/i/web/status/8…', 'indices': [117, 140]}]}",en
801849159800197121,2016-11-24 18:05:11,"This Thanksgiving, we give thanks for our blessings, and work to fulfill the timeless responsibility we have as Americans to serve others.",34055,6888,"{'hashtags': [], 'symbols': [], 'user_mentions': [], 'urls': []}",en
801848753468674048,2016-11-24 18:03:35,The Old Soldiers Home in DC has cared for our nation's veterans for 165 years. I was honored to be a small part of… https://t.co/43ttiaLibI,93838,18521,"{'hashtags': [], 'symbols': [], 'user_mentions': [], 'urls': [{'url': 'https://t.co/43ttiaLibI', 'expanded_url': 'https://twitter.com/i/web/status/801848753468674048', 'display_url': 'twitter.com/i/web/status/8…', 'indices': [116, 139]}]}",en
800468765934690304,2016-11-20 22:40:00,"Happy birthday, Joe! The best @VP and friend I could have had alongside me these past eight years. https://t.co/kWH3L5uSFC",597836,175806,"{'hashtags': [], 'symbols': [], 'user_mentions': [{'screen_name': 'VP', 'name': 'Vice President Mike Pence', 'id': 818910970567344128, 'id_str': '818910970567344128', 'indices': [30, 33]}], 'urls': [], 'media': [{'id': 800468763611045888, 'id_str': '800468763611045888', 'indices': [99, 122], 'media_url': 'http://pbs.twimg.com/media/CxvWGXTVIAATmkH.jpg', 'media_url_https': 'https://pbs.twimg.com/media/CxvWGXTVIAATmkH.jpg', 'url': 'https://t.co/kWH3L5uSFC', 'display_url': 'pic.twitter.com/kWH3L5uSFC', 'expanded_url': 'https://twitter.com/POTUS/status/800468765934690304/photo/1', 'type': 'photo', 'sizes': {'thumb': {'w': 150, 'h': 150, 'resize': 'crop'}, 'medium': {'w': 1024, 'h': 682, 'resize': 'fit'}, 'small': {'w': 680, 'h': 453, 'resize': 'fit'}, 'large': {'w': 1024, 'h': 682, 'resize': 'fit'}}}]}",en
800357392588406785,2016-11-20 15:17:26,One thing I've learned from my time abroad as President: Young people will shape our future long after their leader… https://t.co/bwEltHdPDs,83653,22786,"{'hashtags': [], 'symbols': [], 'user_mentions': [], 'urls': [{'url': 'https://t.co/bwEltHdPDs', 'expanded_url': 'https://twitter.com/i/web/status/800357392588406785', 'display_url': 'twitter.com/i/web/status/8…', 'indices': [117, 140]}]}",en
797128959578271744,2016-11-11 17:28:48,"Today, we honor those who honored our country with its highest form of service. We owe our veterans our thanks, our respect and our freedom.",149971,44460,"{'hashtags': [], 'symbols': [], 'user_mentions': [], 'urls': []}",en
796018814072672256,2016-11-08 15:57:29,"Today, progress is on the ballot. Go vote - then make sure your friends, your family, and everyone you know votes too.",137502,49692,"{'hashtags': [], 'symbols': [], 'user_mentions': [], 'urls': []}",en
794322003754790913,2016-11-03 23:34:58,"It's pretty simple: Find a plan, get covered, earn some peace of mind. Start today: https://t.co/PJ7xIKP3Vo https://t.co/ZBQdNz8s80",25468,6045,"{'hashtags': [], 'symbols': [], 'user_mentions': [], 'urls': [{'url': 'https://t.co/PJ7xIKP3Vo', 'expanded_url': 'http://HealthCare.gov', 'display_url': 'HealthCare.gov', 'indices': [84, 107]}], 'media': [{'id': 794299143942344704, 'id_str': '794299143942344704', 'indices': [108, 131], 'media_url': 'http://pbs.twimg.com/media/CwX_GEnUkAEyLS6.jpg', 'media_url_https': 'https://pbs.twimg.com/media/CwX_GEnUkAEyLS6.jpg', 'url': 'https://t.co/ZBQdNz8s80', 'display_url': 'pic.twitter.com/ZBQdNz8s80', 'expanded_url': 'https://twitter.com/POTUS/status/794322003754790913/video/1', 'type': 'photo', 'sizes': {'large': {'w': 1433, 'h': 798, 'resize': 'fit'}, 'thumb': {'w': 150, 'h': 150, 'resize': 'crop'}, 'medium': {'w': 1200, 'h': 668, 'resize': 'fit'}, 'small': {'w': 680, 'h': 379, 'resize': 'fit'}}}]}",en
794057504871346176,2016-11-03 06:03:56,It happened: @Cubs win World Series. That's change even this South Sider can believe in. Want to come to the White House before I leave?,252959,65315,"{'hashtags': [], 'symbols': [], 'user_mentions': [{'screen_name': 'Cubs', 'name': 'Chicago Cubs', 'id': 41144996, 'id_str': '41144996', 'indices': [13, 18]}], 'urls': []}",en
790236602584948736,2016-10-23 17:01:02,"I'll say it: Holy Cow, @Cubs fans. Even this White Sox fan was happy to see Wrigley rocking last night. #FlyTheW",74900,17960,"{'hashtags': [{'text': 'FlyTheW', 'indices': [104, 112]}], 'symbols': [], 'user_mentions': [{'screen_name': 'Cubs', 'name': 'Chicago Cubs', 'id': 41144996, 'id_str': '41144996', 'indices': [23, 28]}], 'urls': []}",en
789598150541635588,2016-10-21 22:44:03,Check out my newest science advisors! These kids are fearless in using science to tackle our toughest problems. Tha… https://t.co/pLBZQWDFin,60596,12185,"{'hashtags': [], 'symbols': [], 'user_mentions': [], 'urls': [{'url': 'https://t.co/pLBZQWDFin', 'expanded_url': 'https://twitter.com/i/web/status/789598150541635588', 'display_url': 'twitter.com/i/web/status/7…', 'indices': [117, 140]}]}",en
789265672404627456,2016-10-21 00:42:54,RT @vj44: We lit the @WhiteHouse pink tonight to commemorate Breast Cancer Awareness Month. Make sure to enroll in #ACA starting Nov. 1 htt…,0,3961,"{'hashtags': [{'text': 'ACA', 'indices': [115, 119]}], 'symbols': [], 'user_mentions': [{'screen_name': 'vj44', 'name': 'Valerie Jarrett', 'id': 595515713, 'id_str': '595515713', 'indices': [3, 8]}, {'screen_name': 'WhiteHouse', 'name': 'The White House', 'id': 822215673812119553, 'id_str': '822215673812119553', 'indices': [21, 32]}], 'urls': []}",en
789096632537055232,2016-10-20 13:31:12,Outstanding 3 for 3 debate sweep for @HillaryClinton! Nobody has ever been more prepared to be @POTUS.,79111,18604,"{'hashtags': [], 'symbols': [], 'user_mentions': [{'screen_name': 'HillaryClinton', 'name': 'Hillary Clinton', 'id': 1339835893, 'id_str': '1339835893', 'indices': [37, 52]}, {'screen_name': 'POTUS', 'name': 'President Trump', 'id': 822215679726100480, 'id_str': '822215679726100480', 'indices': [95, 101]}], 'urls': []}",en
788098889140219904,2016-10-17 19:26:31,"For the loved ones we've lost and the ones we can still save, thank you Joe for putting us on the path to ending ca… https://t.co/OPPnQIJDl2",23001,5896,"{'hashtags': [], 'symbols': [], 'user_mentions': [], 'urls': [{'url': 'https://t.co/OPPnQIJDl2', 'expanded_url': 'https://twitter.com/i/web/status/788098889140219904', 'display_url': 'twitter.com/i/web/status/7…', 'indices': [117, 140]}]}",en
787662124197830656,2016-10-16 14:30:59,"For a century, Planned Parenthood has made it possible for women to determine their own lives. Here's to another #100YearsStrong.",96331,30867,"{'hashtags': [{'text': '100YearsStrong', 'indices': [113, 128]}], 'symbols': [], 'user_mentions': [], 'urls': []}",en
787047018606784512,2016-10-14 21:46:46,"Clearly, we still have more to do to prevent sexual assault and the thinking that leads to it. That starts with us: https://t.co/9PRZB451fS",40654,14052,"{'hashtags': [], 'symbols': [], 'user_mentions': [], 'urls': [{'url': 'https://t.co/9PRZB451fS', 'expanded_url': 'http://ItsOnUs.org', 'display_url': 'ItsOnUs.org', 'indices': [116, 139]}]}",en
786598777482153988,2016-10-13 16:05:37,"Congratulations to one of my favorite poets, Bob Dylan, on a well-deserved Nobel. https://t.co/c9cnANWPCS",30332,10220,"{'hashtags': [], 'symbols': [], 'user_mentions': [], 'urls': [{'url': 'https://t.co/c9cnANWPCS', 'expanded_url': 'http://spoti.fi/25fTuWt', 'display_url': 'spoti.fi/25fTuWt', 'indices': [82, 105]}]}",en
786254141182074880,2016-10-12 17:16:09,"Now this was fun. Artificial intelligence, space travel—hope you enjoy exploring new frontiers as much as I did. https://t.co/WWBUm5eJ08",24313,6875,"{'hashtags': [], 'symbols': [], 'user_mentions': [], 'urls': [{'url': 'https://t.co/WWBUm5eJ08', 'expanded_url': 'https://twitter.com/wired/status/786159612940656641', 'display_url': 'twitter.com/wired/status/7…', 'indices': [113, 136]}]}",en
785887247727857664,2016-10-11 16:58:15,"On International #DayoftheGirl, we remain committed to providing what we all want for our daughters: a future of limitless possibility.",55291,21908,"{'hashtags': [{'text': 'DayoftheGirl', 'indices': [17, 30]}], 'symbols': [], 'user_mentions': [], 'urls': []}",en
785511825395765248,2016-10-10 16:06:27,"Just like Michelle says, when they go low, we go high. @HillaryClinton went high and showed why she'll be a POTUS for all Americans.",90762,23275,"{'hashtags': [], 'symbols': [], 'user_mentions': [{'screen_name': 'HillaryClinton', 'name': 'Hillary Clinton', 'id': 1339835893, 'id_str': '1339835893', 'indices': [55, 70]}], 'urls': []}",en
784508784316063744,2016-10-07 21:40:44,Voted early today. Make sure you vote too: https://t.co/SUUmUADsHj https://t.co/NMesNhwsaG,50760,14402,"{'hashtags': [], 'symbols': [], 'user_mentions': [], 'urls': [{'url': 'https://t.co/SUUmUADsHj', 'expanded_url': 'http://Vote.gov', 'display_url': 'Vote.gov', 'indices': [43, 66]}], 'media': [{'id': 784508770831314944, 'id_str': '784508770831314944', 'indices': [67, 90], 'media_url': 'http://pbs.twimg.com/media/CuMikhCUMAAfJl0.jpg', 'media_url_https': 'https://pbs.twimg.com/media/CuMikhCUMAAfJl0.jpg', 'url': 'https://t.co/NMesNhwsaG', 'display_url': 'pic.twitter.com/NMesNhwsaG', 'expanded_url': 'https://twitter.com/POTUS/status/784508784316063744/photo/1', 'type': 'photo', 'sizes': {'thumb': {'w': 150, 'h': 150, 'resize': 'crop'}, 'large': {'w': 2048, 'h': 1364, 'resize': 'fit'}, 'small': {'w': 680, 'h': 453, 'resize': 'fit'}, 'medium': {'w': 1200, 'h': 799, 'resize': 'fit'}}}]}",en
784170804279992320,2016-10-06 23:17:43,"Hurricane Matthew is as serious as it gets. Listen to local officials, prepare, take care of each other. https://t.co/Vaf8Xubs0s",25366,9491,"{'hashtags': [], 'symbols': [], 'user_mentions': [], 'urls': [{'url': 'https://t.co/Vaf8Xubs0s', 'expanded_url': 'http://Ready.gov', 'display_url': 'Ready.gov', 'indices': [105, 128]}]}",en
783771904297447424,2016-10-05 20:52:38,Thank you to every nation that moved to bring the Paris Agreement into force. History will judge today as a turning point for our planet.,38009,9896,"{'hashtags': [], 'symbols': [], 'user_mentions': [], 'urls': []}",en
782970909229326336,2016-10-03 15:49:46,Bringing a little Austin to the South Lawn today. https://t.co/qCXwVI0uLH https://t.co/nTb10I3GHP,15029,4795,"{'hashtags': [], 'symbols': [], 'user_mentions': [], 'urls': [{'url': 'https://t.co/qCXwVI0uLH', 'expanded_url': 'http://wh.gov/SXSL', 'display_url': 'wh.gov/SXSL', 'indices': [50, 73]}], 'media': [{'id': 782970546363346944, 'id_str': '782970546363346944', 'indices': [74, 97], 'media_url': 'http://pbs.twimg.com/media/Ct2rkEWUsAAnI2K.jpg', 'media_url_https': 'https://pbs.twimg.com/media/Ct2rkEWUsAAnI2K.jpg', 'url': 'https://t.co/nTb10I3GHP', 'display_url': 'pic.twitter.com/nTb10I3GHP', 'expanded_url': 'https://twitter.com/POTUS/status/782970909229326336/photo/1', 'type': 'photo', 'sizes': {'thumb': {'w': 150, 'h': 150, 'resize': 'crop'}, 'large': {'w': 2048, 'h': 1769, 'resize': 'fit'}, 'small': {'w': 680, 'h': 587, 'resize': 'fit'}, 'medium': {'w': 1200, 'h': 1037, 'resize': 'fit'}}}]}",en
782762238616727552,2016-10-03 02:00:35,What a win by the USA in #RyderCup. Proud to see our guys bring the trophy back home. Arnie is smiling down.,19011,3494,"{'hashtags': [{'text': 'RyderCup', 'indices': [25, 34]}], 'symbols': [], 'user_mentions': [], 'urls': []}",en
782594690738597888,2016-10-02 14:54:48,"Gandhiji believed in a world worthy of our children. In joining the Paris Agreement, @narendramodi &amp; the Indian people carry on that legacy.",35055,13870,"{'hashtags': [], 'symbols': [], 'user_mentions': [{'screen_name': 'narendramodi', 'name': 'Narendra Modi', 'id': 18839785, 'id_str': '18839785', 'indices': [85, 98]}], 'urls': []}",en
782218662228942848,2016-10-01 14:00:36,Paid leave shouldn't be a luxury. It's a basic necessity that we should secure for every working American. https://t.co/OPeQiVPJlK,16421,4693,"{'hashtags': [], 'symbols': [], 'user_mentions': [], 'urls': [{'url': 'https://t.co/OPeQiVPJlK', 'expanded_url': 'http://nyti.ms/2cIsldp', 'display_url': 'nyti.ms/2cIsldp', 'indices': [107, 130]}]}",en
781639251528081409,2016-09-29 23:38:14,"Our Olympians and Paralympians show the world that no matter what, with perseverance, we can do incredible things. Proud of you, #TeamUSA.",21117,3607,"{'hashtags': [{'text': 'TeamUSA', 'indices': [129, 137]}], 'symbols': [], 'user_mentions': [], 'urls': []}",en
780906000391864320,2016-09-27 23:04:33,Couldn't be more proud of @HillaryClinton. Her vision and command during last night's debate showed that she's ready to be our next @POTUS.,88144,21643,"{'hashtags': [], 'symbols': [], 'user_mentions': [{'screen_name': 'HillaryClinton', 'name': 'Hillary Clinton', 'id': 1339835893, 'id_str': '1339835893', 'indices': [26, 41]}, {'screen_name': 'POTUS', 'name': 'President Trump', 'id': 822215679726100480, 'id_str': '822215679726100480', 'indices': [132, 138]}], 'urls': []}",en
780809121314504704,2016-09-27 16:39:35,Democracy is not a spectator sport. Don't give up your power to shape the future of the country we love. Vote: https://t.co/sUxB8TLc5r,32354,14734,"{'hashtags': [], 'symbols': [], 'user_mentions': [], 'urls': [{'url': 'https://t.co/sUxB8TLc5r', 'expanded_url': 'http://www.vote.gov', 'display_url': 'vote.gov', 'indices': [111, 134]}]}",en
780480428872306688,2016-09-26 18:53:29,RT @NYTNational: Census data shows 3.5 million Americans were able to raise their chins above the poverty line last year https://t.co/FEr5e…,0,1123,"{'hashtags': [], 'symbols': [], 'user_mentions': [{'screen_name': 'NYTNational', 'name': 'NYT National News', 'id': 1767741, 'id_str': '1767741', 'indices': [3, 15]}], 'urls': []}",en
780244157625278464,2016-09-26 03:14:38,"Here's to The King who was as extraordinary on the links as he was generous to others. Thanks for the memories, Arn… https://t.co/r4dLQqt45A",47325,10751,"{'hashtags': [], 'symbols': [], 'user_mentions': [], 'urls': [{'url': 'https://t.co/r4dLQqt45A', 'expanded_url': 'https://twitter.com/i/web/status/780244157625278464', 'display_url': 'twitter.com/i/web/status/7…', 'indices': [117, 140]}]}",en
