id,created_at,text,favorites,retweets,entities,language
708348813858054145,2016-03-11 17:48:12,"Looking forward to discussing more ways we can modernize government so it's as smart and dynamic as America itself. See you soon, Austin.",5079,1685,"{'hashtags': [], 'symbols': [], 'user_mentions': [], 'urls': []}",en
708346933933416449,2016-03-11 17:40:44,Seniors can now apply for Social Security benefits online: https://t.co/jPEHLkNxfk,2796,1005,"{'hashtags': [], 'symbols': [], 'user_mentions': [], 'urls': [{'url': 'https://t.co/jPEHLkNxfk', 'expanded_url': 'http://1.usa.gov/1RTe2O8', 'display_url': '1.usa.gov/1RTe2O8', 'indices': [59, 82]}]}",en
708346091578593280,2016-03-11 17:37:23,Nearly 1 in 3 American families struggle to afford diapers. We're working with the private sector to help fix this. https://t.co/fxvdOCFeET,3877,1636,"{'hashtags': [], 'symbols': [], 'user_mentions': [], 'urls': [], 'media': [{'id': 708346090798641152, 'id_str': '708346090798641152', 'indices': [116, 139], 'media_url': 'http://pbs.twimg.com/media/CdSNBEAW8AARFeS.jpg', 'media_url_https': 'https://pbs.twimg.com/media/CdSNBEAW8AARFeS.jpg', 'url': 'https://t.co/fxvdOCFeET', 'display_url': 'pic.twitter.com/fxvdOCFeET', 'expanded_url': 'https://twitter.com/POTUS/status/708346091578593280/photo/1', 'type': 'photo', 'sizes': {'thumb': {'w': 150, 'h': 150, 'resize': 'crop'}, 'large': {'w': 1200, 'h': 600, 'resize': 'fit'}, 'medium': {'w': 1200, 'h': 600, 'resize': 'fit'}, 'small': {'w': 680, 'h': 340, 'resize': 'fit'}}}]}",en
708345011037798400,2016-03-11 17:33:05,"Immigrants can now apply online to renew their green cards faster, and prep for the citizenship civics test online.",4147,1867,"{'hashtags': [], 'symbols': [], 'user_mentions': [], 'urls': []}",en
708344230729555970,2016-03-11 17:29:59,We've cut the time it takes students to apply for financial aid by two-thirds thanks to a simplified FAFSA form: https://t.co/WDD1UrSXIR,3443,1292,"{'hashtags': [], 'symbols': [], 'user_mentions': [], 'urls': [{'url': 'https://t.co/WDD1UrSXIR', 'expanded_url': 'http://fafsa.gov', 'display_url': 'fafsa.gov', 'indices': [113, 136]}]}",en
708343852470435840,2016-03-11 17:28:29,"At #SXSW, I'll make the case that tech and innovation can make government work better for everyone. Here's how it's working better already:",7226,2195,"{'hashtags': [{'text': 'SXSW', 'indices': [3, 8]}], 'symbols': [], 'user_mentions': [], 'urls': []}",en
707323697493704704,2016-03-08 21:54:45,"Happy #InternationalWomensDay! When women are free to pursue their dreams, nations are more safe, more secure, and more prosperous.",32996,17197,"{'hashtags': [{'text': 'InternationalWomensDay', 'indices': [6, 29]}], 'symbols': [], 'user_mentions': [], 'urls': []}",en
705090664086773764,2016-03-02 18:01:28,"Welcome back to Earth, @StationCDRKelly! Your year in space is vital to the future of American space travel. Hope gravity isn't a drag!",36961,10198,"{'hashtags': [], 'symbols': [], 'user_mentions': [{'screen_name': 'StationCDRKelly', 'name': 'Scott Kelly', 'id': 65647594, 'id_str': '65647594', 'indices': [23, 39]}], 'urls': []}",en
704827179167846400,2016-03-02 00:34:29,Play ball! https://t.co/S4DhVYa4Ef,5762,2013,"{'hashtags': [], 'symbols': [], 'user_mentions': [], 'urls': [{'url': 'https://t.co/S4DhVYa4Ef', 'expanded_url': 'https://twitter.com/mlb/status/704825692890923008', 'display_url': 'twitter.com/mlb/status/704…', 'indices': [11, 34]}]}",en
703359876483977217,2016-02-26 23:23:57,"Isiah, I'm so proud of you. Your kindness and willingness to help others is why I'm so hopeful for our future. https://t.co/RakSNxe7rk",11697,4627,"{'hashtags': [], 'symbols': [], 'user_mentions': [], 'urls': [{'url': 'https://t.co/RakSNxe7rk', 'expanded_url': 'http://huff.to/21u24PG', 'display_url': 'huff.to/21u24PG', 'indices': [111, 134]}]}",en
701871557002407936,2016-02-22 20:49:53,We've made big strides in the fight against Malaria - saving millions of lives. That's American leadership at work. https://t.co/jVdeE4Qktw,6652,2277,"{'hashtags': [], 'symbols': [], 'user_mentions': [], 'urls': [], 'media': [{'id': 701871549821767680, 'id_str': '701871549821767680', 'indices': [116, 139], 'media_url': 'http://pbs.twimg.com/media/Cb2MdLUUUAA3FcI.jpg', 'media_url_https': 'https://pbs.twimg.com/media/Cb2MdLUUUAA3FcI.jpg', 'url': 'https://t.co/jVdeE4Qktw', 'display_url': 'pic.twitter.com/jVdeE4Qktw', 'expanded_url': 'https://twitter.com/POTUS/status/701871557002407936/photo/1', 'type': 'photo', 'sizes': {'medium': {'w': 1024, 'h': 512, 'resize': 'fit'}, 'thumb': {'w': 150, 'h': 150, 'resize': 'crop'}, 'large': {'w': 1024, 'h': 512, 'resize': 'fit'}, 'small': {'w': 680, 'h': 340, 'resize': 'fit'}}}]}",en
700320856858189824,2016-02-18 14:07:58,Here's how we're looking at the road ahead: https://t.co/a0KcsmpF39,4301,1813,"{'hashtags': [], 'symbols': [], 'user_mentions': [], 'urls': [{'url': 'https://t.co/a0KcsmpF39', 'expanded_url': 'http://go.wh.gov/4b4M4z', 'display_url': 'go.wh.gov/4b4M4z', 'indices': [44, 67]}]}",en
700320240022921216,2016-02-18 14:05:31,"Next month, I'll travel to Cuba to advance our progress and efforts that can improve the lives of the Cuban people.",11593,6000,"{'hashtags': [], 'symbols': [], 'user_mentions': [], 'urls': []}",en
700319754054074368,2016-02-18 14:03:35,We still have differences with the Cuban government that I will raise directly. America will always stand for human rights around the world.,4519,2126,"{'hashtags': [], 'symbols': [], 'user_mentions': [], 'urls': []}",en
700319236451741697,2016-02-18 14:01:31,Our flag flies over our Embassy in Havana once again. More Americans are traveling to Cuba than at any time in the last 50 years.,4575,1982,"{'hashtags': [], 'symbols': [], 'user_mentions': [], 'urls': []}",en
700318872147066880,2016-02-18 14:00:05,"14 months ago, I announced that we would begin normalizing relations with Cuba - and we've already made significant progress.",10654,2766,"{'hashtags': [], 'symbols': [], 'user_mentions': [], 'urls': []}",en
698574908247425024,2016-02-13 18:30:11,Got a view yesterday of the lands we protected in CA. We owe it to our kids to preserve America's natural beauty. https://t.co/8OR9MrupyG,23684,6202,"{'hashtags': [], 'symbols': [], 'user_mentions': [], 'urls': [], 'media': [{'id': 698574894293000194, 'id_str': '698574894293000194', 'indices': [114, 137], 'media_url': 'http://pbs.twimg.com/media/CbHWKkdXIAIfmgu.jpg', 'media_url_https': 'https://pbs.twimg.com/media/CbHWKkdXIAIfmgu.jpg', 'url': 'https://t.co/8OR9MrupyG', 'display_url': 'pic.twitter.com/8OR9MrupyG', 'expanded_url': 'https://twitter.com/POTUS/status/698574908247425024/photo/1', 'type': 'photo', 'sizes': {'thumb': {'w': 150, 'h': 150, 'resize': 'crop'}, 'large': {'w': 1024, 'h': 702, 'resize': 'fit'}, 'small': {'w': 680, 'h': 466, 'resize': 'fit'}, 'medium': {'w': 1024, 'h': 702, 'resize': 'fit'}}}]}",en
697928913457188864,2016-02-11 23:43:14,Einstein was right! Congrats to @NSF and @LIGO on detecting gravitational waves - a huge breakthrough in how we understand the universe.,18954,7963,"{'hashtags': [], 'symbols': [], 'user_mentions': [{'screen_name': 'NSF', 'name': 'National Science Foundation', 'id': 16245822, 'id_str': '16245822', 'indices': [32, 36]}, {'screen_name': 'LIGO', 'name': 'LIGO', 'id': 15000857, 'id_str': '15000857', 'indices': [41, 46]}], 'urls': []}",en
697824490344968192,2016-02-11 16:48:18,"Way to ace your AP Calc test, Landon! You should come drop some knowledge at the White House Science Fair: https://t.co/hFaAgxVdEE",5263,1347,"{'hashtags': [], 'symbols': [], 'user_mentions': [], 'urls': [{'url': 'https://t.co/hFaAgxVdEE', 'expanded_url': 'http://wapo.st/1RpdCk9', 'display_url': 'wapo.st/1RpdCk9', 'indices': [107, 130]}]}",en
697185842209689601,2016-02-09 22:30:32,"Just got off the phone with Coach Kubiak. Congrats to Peyton, Von Miller, and that monster @Broncos defense - see you at the White House!",14667,5387,"{'hashtags': [], 'symbols': [], 'user_mentions': [{'screen_name': 'Broncos', 'name': 'Denver Broncos', 'id': 18734310, 'id_str': '18734310', 'indices': [91, 99]}], 'urls': []}",en
695381352988848128,2016-02-04 23:00:08,Just got great news - nearly 13 million Americans signed up this round for private health insurance thanks to the Affordable Care Act.,13655,3480,"{'hashtags': [], 'symbols': [], 'user_mentions': [], 'urls': []}",en
693841529169952768,2016-01-31 17:01:26,Cedrick; way to go on your perfect score! How about you come by the next White House Science Fair? https://t.co/r8TGIJICh7,6326,1796,"{'hashtags': [], 'symbols': [], 'user_mentions': [], 'urls': [{'url': 'https://t.co/r8TGIJICh7', 'expanded_url': 'http://lat.ms/1TphKB4', 'display_url': 'lat.ms/1TphKB4', 'indices': [99, 122]}]}",en
693818704019193860,2016-01-31 15:30:44,"If you or someone you care about needs affordable health coverage, head over to https://t.co/A3qPizu4p2. Today's the last day to sign up!",5204,2967,"{'hashtags': [], 'symbols': [], 'user_mentions': [], 'urls': [{'url': 'https://t.co/A3qPizu4p2', 'expanded_url': 'http://Healthcare.gov', 'display_url': 'Healthcare.gov', 'indices': [80, 103]}]}",en
693116531064967168,2016-01-29 17:00:33,We just took an important step on equal pay. Let's keep at it until every woman &amp; girl gets a fair shot at success: https://t.co/OJAsaK6ImG,7735,3914,"{'hashtags': [], 'symbols': [], 'user_mentions': [], 'urls': [{'url': 'https://t.co/OJAsaK6ImG', 'expanded_url': 'http://nyti.ms/23x9PWO', 'display_url': 'nyti.ms/23x9PWO', 'indices': [120, 143]}]}",en
691735740649050112,2016-01-25 21:33:47,The science couldn't be clearer - we owe it to our kids to do everything we can to combat climate change. https://t.co/497Wkkve58,23538,14588,"{'hashtags': [], 'symbols': [], 'user_mentions': [], 'urls': [], 'media': [{'id': 691735736458981376, 'id_str': '691735736458981376', 'indices': [106, 129], 'media_url': 'http://pbs.twimg.com/media/CZmJ_MIUsAA5GKP.jpg', 'media_url_https': 'https://pbs.twimg.com/media/CZmJ_MIUsAA5GKP.jpg', 'url': 'https://t.co/497Wkkve58', 'display_url': 'pic.twitter.com/497Wkkve58', 'expanded_url': 'https://twitter.com/POTUS/status/691735740649050112/photo/1', 'type': 'photo', 'sizes': {'thumb': {'w': 150, 'h': 150, 'resize': 'crop'}, 'large': {'w': 1024, 'h': 576, 'resize': 'fit'}, 'medium': {'w': 1024, 'h': 576, 'resize': 'fit'}, 'small': {'w': 680, 'h': 383, 'resize': 'fit'}}}]}",en
689843464951885824,2016-01-20 16:14:33,Seven years ago I bet on American workers and the American auto industry. I’d make that bet again any day of the week.,4780,1577,"{'hashtags': [], 'symbols': [], 'user_mentions': [], 'urls': []}",en
689842173999640576,2016-01-20 16:09:25,Cars and trucks made in the USA are more fuel efficient than ever before – and still the best in the world.,3294,1009,"{'hashtags': [], 'symbols': [], 'user_mentions': [], 'urls': []}",en
689841261902098432,2016-01-20 16:05:48,"American automakers have added more than 640,000 jobs since mid-2009 – the strongest job growth on record. https://t.co/kLruJgpZI1",2253,1122,"{'hashtags': [], 'symbols': [], 'user_mentions': [], 'urls': [], 'media': [{'id': 689841172659843072, 'id_str': '689841172659843072', 'indices': [107, 130], 'media_url': 'http://pbs.twimg.com/tweet_video_thumb/CZLO5D_UMAA4ioF.png', 'media_url_https': 'https://pbs.twimg.com/tweet_video_thumb/CZLO5D_UMAA4ioF.png', 'url': 'https://t.co/kLruJgpZI1', 'display_url': 'pic.twitter.com/kLruJgpZI1', 'expanded_url': 'https://twitter.com/POTUS/status/689841261902098432/photo/1', 'type': 'photo', 'sizes': {'large': {'w': 1200, 'h': 600, 'resize': 'fit'}, 'medium': {'w': 1200, 'h': 600, 'resize': 'fit'}, 'small': {'w': 680, 'h': 340, 'resize': 'fit'}, 'thumb': {'w': 150, 'h': 150, 'resize': 'crop'}}}]}",en
689840513852137477,2016-01-20 16:02:49,"In 2009, auto sales hit a 27-year low. Last year, they hit an all-time high. https://t.co/pDc8W8mtb5",2818,1404,"{'hashtags': [], 'symbols': [], 'user_mentions': [], 'urls': [], 'media': [{'id': 689840513097138178, 'id_str': '689840513097138178', 'indices': [77, 100], 'media_url': 'http://pbs.twimg.com/media/CZLOSq7UAAIB2Cn.jpg', 'media_url_https': 'https://pbs.twimg.com/media/CZLOSq7UAAIB2Cn.jpg', 'url': 'https://t.co/pDc8W8mtb5', 'display_url': 'pic.twitter.com/pDc8W8mtb5', 'expanded_url': 'https://twitter.com/POTUS/status/689840513852137477/photo/1', 'type': 'photo', 'sizes': {'thumb': {'w': 150, 'h': 150, 'resize': 'crop'}, 'medium': {'w': 1200, 'h': 675, 'resize': 'fit'}, 'small': {'w': 680, 'h': 383, 'resize': 'fit'}, 'large': {'w': 1280, 'h': 720, 'resize': 'fit'}}}]}",en
689840000456794112,2016-01-20 16:00:47,Headed to the Detroit Auto Show today to showcase how our auto industry has come roaring back from the financial crisis. Here are the stats:,6939,1831,"{'hashtags': [], 'symbols': [], 'user_mentions': [], 'urls': []}",en
689100817580867584,2016-01-18 15:03:32,Today we honor a man who challenged us to bend the arc of the moral universe toward justice. Let's keep working to realize Dr. King's dream.,44766,27405,"{'hashtags': [], 'symbols': [], 'user_mentions': [], 'urls': []}",en
687699148468977665,2016-01-14 18:13:48,"Alright everyone, this was a lot of fun. Thanks for the great conversation. i'll be back soon!",5417,1012,"{'hashtags': [], 'symbols': [], 'user_mentions': [], 'urls': []}",en
687698858948726784,2016-01-14 18:12:39,places to start - @GabbyGiffords's https://t.co/ATm1M4iMgU and @Everytown,1778,618,"{'hashtags': [], 'symbols': [], 'user_mentions': [{'screen_name': 'GabbyGiffords', 'name': 'Gabrielle Giffords', 'id': 44177383, 'id_str': '44177383', 'indices': [18, 32]}, {'screen_name': 'Everytown', 'name': 'Everytown', 'id': 250386727, 'id_str': '250386727', 'indices': [63, 73]}], 'urls': [{'url': 'https://t.co/ATm1M4iMgU', 'expanded_url': 'http://americansforresponsiblesolutions.org', 'display_url': 'americansforresponsiblesolutions.org', 'indices': [35, 58]}]}",en
687698446619312128,2016-01-14 18:11:01,great - we need well-meaning folks from all stripes to get info on how we can respect 2A and reduce gun violence https://t.co/dZ0vRltrZg,1843,605,"{'hashtags': [], 'symbols': [], 'user_mentions': [], 'urls': [{'url': 'https://t.co/dZ0vRltrZg', 'expanded_url': 'https://twitter.com/drpearcekorb/status/687429380755308544', 'display_url': 'twitter.com/drpearcekorb/s…', 'indices': [113, 136]}]}",en
687697711605272576,2016-01-14 18:08:05,"the night aca passed; standing on truman balcony with all staff whod made it happen, knowing we'd helped millions. https://t.co/eUr3rZ3UN7",4209,1288,"{'hashtags': [], 'symbols': [], 'user_mentions': [], 'urls': [{'url': 'https://t.co/eUr3rZ3UN7', 'expanded_url': 'https://twitter.com/nialler4th_lee/status/687669713313349633', 'display_url': 'twitter.com/nialler4th_lee…', 'indices': [115, 138]}]}",en
687697228895399937,2016-01-14 18:06:10,despite court cases like citizens united ill work with orgs/states across US to find new ways 2 reduce $ in politics https://t.co/fuTdewJcyh,1576,542,"{'hashtags': [], 'symbols': [], 'user_mentions': [], 'urls': [{'url': 'https://t.co/fuTdewJcyh', 'expanded_url': 'https://twitter.com/balau/status/687670118847885312', 'display_url': 'twitter.com/balau/status/6…', 'indices': [117, 140]}]}",en
687695962198781953,2016-01-14 18:01:08,"so we all need to speak out against bias and stereotypes, to protect the freedom of others, and our own as well.",4551,2587,"{'hashtags': [], 'symbols': [], 'user_mentions': [], 'urls': []}",en
687695621810032640,2016-01-14 17:59:47,overwhelming majority of americans understand of diversity and religious pluralism is one of our greatest strengths  https://t.co/AM1JLoA1TI,2765,1201,"{'hashtags': [], 'symbols': [], 'user_mentions': [], 'urls': [{'url': 'https://t.co/AM1JLoA1TI', 'expanded_url': 'https://twitter.com/marcplummer1998/status/687655494098407425', 'display_url': 'twitter.com/marcplummer199…', 'indices': [117, 140]}]}",en
687695122327158785,2016-01-14 17:57:48,"health care inflation lowest in decades since ACA passed; problem is more costs passed to workers thru copays, etc. https://t.co/ElBcrjxa6L",1415,545,"{'hashtags': [], 'symbols': [], 'user_mentions': [], 'urls': [{'url': 'https://t.co/ElBcrjxa6L', 'expanded_url': 'https://twitter.com/shirleyp_2009/status/687660738752544768', 'display_url': 'twitter.com/shirleyp_2009/…', 'indices': [116, 139]}]}",en
687694645090844672,2016-01-14 17:55:54,"love em all, but as a bulls fan got to go with mj. in baton rouge, just met lsu freshman ben simmons - will be great https://t.co/Du1gflVYp4",5651,3167,"{'hashtags': [], 'symbols': [], 'user_mentions': [], 'urls': [{'url': 'https://t.co/Du1gflVYp4', 'expanded_url': 'https://twitter.com/kool_ant/status/687671251112861696', 'display_url': 'twitter.com/kool_ant/statu…', 'indices': [117, 140]}]}",en
687694262226432000,2016-01-14 17:54:23,"new power plant rule reduces biggest source of CO2; now we need to invest in clean energy tech, energy efficiency. https://t.co/gQg3FEHXxo",1953,817,"{'hashtags': [], 'symbols': [], 'user_mentions': [], 'urls': [{'url': 'https://t.co/gQg3FEHXxo', 'expanded_url': 'https://twitter.com/Brentrou/status/687663122832846852', 'display_url': 'twitter.com/Brentrou/statu…', 'indices': [115, 138]}]}",en
687693536204996608,2016-01-14 17:51:30,new LA gov edwards just expanded medicaid; gets 1000s coverage &amp; helps the state budget. more states need to follow  https://t.co/08mDX2H4Pt,1699,718,"{'hashtags': [], 'symbols': [], 'user_mentions': [], 'urls': [{'url': 'https://t.co/08mDX2H4Pt', 'expanded_url': 'https://twitter.com/1time4bryant/status/687674876069453824', 'display_url': 'twitter.com/1time4bryant/s…', 'indices': [121, 144]}]}",en
687692698573082624,2016-01-14 17:48:10,"Expanded pell grants, capped loan repayments at 10% income, but now want to also make 2 yrs community college free. https://t.co/RS9XFDpp9c",4526,2527,"{'hashtags': [], 'symbols': [], 'user_mentions': [], 'urls': [{'url': 'https://t.co/RS9XFDpp9c', 'expanded_url': 'https://twitter.com/SydAlexisss/status/687662507348127744', 'display_url': 'twitter.com/SydAlexisss/st…', 'indices': [116, 139]}]}",en
687692019372707840,2016-01-14 17:45:28,"Before I start, wanted to share this. Liberia is now Ebola-free. Great example of what we can achieve when we lead. https://t.co/qjVcwg8tIi",6290,2703,"{'hashtags': [], 'symbols': [], 'user_mentions': [], 'urls': [], 'media': [{'id': 687691981196152832, 'id_str': '687691981196152832', 'indices': [116, 139], 'media_url': 'http://pbs.twimg.com/tweet_video_thumb/CYssNp4U0AAHAnN.png', 'media_url_https': 'https://pbs.twimg.com/tweet_video_thumb/CYssNp4U0AAHAnN.png', 'url': 'https://t.co/qjVcwg8tIi', 'display_url': 'pic.twitter.com/qjVcwg8tIi', 'expanded_url': 'https://twitter.com/POTUS/status/687692019372707840/photo/1', 'type': 'photo', 'sizes': {'large': {'w': 1200, 'h': 600, 'resize': 'fit'}, 'medium': {'w': 1200, 'h': 600, 'resize': 'fit'}, 'small': {'w': 680, 'h': 340, 'resize': 'fit'}, 'thumb': {'w': 150, 'h': 150, 'resize': 'crop'}}}]}",en
687691919065915392,2016-01-14 17:45:04,Hey everyone! Ready to answer your questions here at McKinley High School in Baton Rouge. Let's do this. #AskPOTUS https://t.co/jA1MEbwcxg,4583,1434,"{'hashtags': [{'text': 'AskPOTUS', 'indices': [105, 114]}], 'symbols': [], 'user_mentions': [], 'urls': [], 'media': [{'id': 687691515167019008, 'id_str': '687691515167019008', 'indices': [115, 138], 'media_url': 'http://pbs.twimg.com/ext_tw_video_thumb/687691515167019008/pu/img/lNWrxqngAzseuY13.jpg', 'media_url_https': 'https://pbs.twimg.com/ext_tw_video_thumb/687691515167019008/pu/img/lNWrxqngAzseuY13.jpg', 'url': 'https://t.co/jA1MEbwcxg', 'display_url': 'pic.twitter.com/jA1MEbwcxg', 'expanded_url': 'https://twitter.com/POTUS/status/687691919065915392/video/1', 'type': 'photo', 'sizes': {'thumb': {'w': 150, 'h': 150, 'resize': 'crop'}, 'small': {'w': 383, 'h': 680, 'resize': 'fit'}, 'large': {'w': 720, 'h': 1280, 'resize': 'fit'}, 'medium': {'w': 675, 'h': 1200, 'resize': 'fit'}}}]}",en
687650227558326272,2016-01-14 14:59:24,Looking forward to hearing your ideas about what we can accomplish this year &amp; beyond. I'll answer your questions on #AskPOTUS at 12:30p ET.,3227,1178,"{'hashtags': [{'text': 'AskPOTUS', 'indices': [121, 130]}], 'symbols': [], 'user_mentions': [], 'urls': []}",en
687081708886355968,2016-01-13 01:20:19,"I'm treating this last State of the Union just like my first - because I'm still just as hungry. I hope you tune in, because it's for you.",37586,15218,"{'hashtags': [], 'symbols': [], 'user_mentions': [], 'urls': []}",en
687046052822781952,2016-01-12 22:58:38,"So proud of you, Scott. How long is the delay up there? See you when you get back!  https://t.co/doBpaDeZXq",8545,2133,"{'hashtags': [], 'symbols': [], 'user_mentions': [], 'urls': [{'url': 'https://t.co/doBpaDeZXq', 'expanded_url': 'https://twitter.com/stationcdrkelly/status/687023415606165504', 'display_url': 'twitter.com/stationcdrkell…', 'indices': [84, 107]}]}",en
684862266978742272,2016-01-06 22:21:03,"About time, Denis! Welcome. Let me know if you need any pointers. https://t.co/WullueHj28",3073,786,"{'hashtags': [], 'symbols': [], 'user_mentions': [], 'urls': [{'url': 'https://t.co/WullueHj28', 'expanded_url': 'https://twitter.com/denis44/status/684858419174617088', 'display_url': 'twitter.com/denis44/status…', 'indices': [66, 89]}]}",en
684158987185614849,2016-01-04 23:46:28,"The gun lobby may be holding Congress hostage, but they can't hold America hostage. We can't accept this carnage in our communities.",21243,10741,"{'hashtags': [], 'symbols': [], 'user_mentions': [], 'urls': []}",en
684157715837403136,2016-01-04 23:41:25,What's often ignored in this debate is that a majority of gun owners agree with commonsense steps to save lives.,10994,4477,"{'hashtags': [], 'symbols': [], 'user_mentions': [], 'urls': []}",en
684156422179786752,2016-01-04 23:36:16,"We will keep guns out of the wrong hands, enforce our guns laws, and ensure those with serious mental illnesses get treatment.",9160,4479,"{'hashtags': [], 'symbols': [], 'user_mentions': [], 'urls': []}",en
684155537433309184,2016-01-04 23:32:45,"Tomorrow, I'm taking action to reduce gun violence and save lives - protecting the Second Amendment and our kids. https://t.co/vNqXEhaC9M",13053,7563,"{'hashtags': [], 'symbols': [], 'user_mentions': [], 'urls': [], 'media': [{'id': 684155536619655169, 'id_str': '684155536619655169', 'indices': [114, 137], 'media_url': 'http://pbs.twimg.com/media/CX6b1fNU0AEdrgV.jpg', 'media_url_https': 'https://pbs.twimg.com/media/CX6b1fNU0AEdrgV.jpg', 'url': 'https://t.co/vNqXEhaC9M', 'display_url': 'pic.twitter.com/vNqXEhaC9M', 'expanded_url': 'https://twitter.com/POTUS/status/684155537433309184/photo/1', 'type': 'photo', 'sizes': {'thumb': {'w': 150, 'h': 150, 'resize': 'crop'}, 'large': {'w': 1200, 'h': 600, 'resize': 'fit'}, 'medium': {'w': 1200, 'h': 600, 'resize': 'fit'}, 'small': {'w': 680, 'h': 340, 'resize': 'fit'}}}]}",en
684154637436370944,2016-01-04 23:29:11,"Guns now kill as many people as cars in almost half of the U.S. We can't stop every act of violence, but we can save lives if we act.",8523,5231,"{'hashtags': [], 'symbols': [], 'user_mentions': [], 'urls': []}",en
684153926636015616,2016-01-04 23:26:21,"Each year, more than 30,000 American lives are cut short by guns - two-thirds coming from suicides. Too many Americans have lost loved ones.",15933,7688,"{'hashtags': [], 'symbols': [], 'user_mentions': [], 'urls': []}",en
680464195993911296,2015-12-25 19:04:41,"From the Obama family to yours, Merry Christmas! And a special thank you to all our men and women in uniform this holiday season.",27074,6957,"{'hashtags': [], 'symbols': [], 'user_mentions': [], 'urls': []}",en
679773729749078016,2015-12-23 21:21:01,I'm proud of the @NBA for taking a stand against gun violence. Sympathy for victims isn't enough – change requires all of us speaking up.,14919,6222,"{'hashtags': [], 'symbols': [], 'user_mentions': [{'screen_name': 'NBA', 'name': 'NBA', 'id': 19923144, 'id_str': '19923144', 'indices': [17, 21]}], 'urls': []}",en
678656661024858112,2015-12-20 19:22:11,Zaevion Dobson died saving three friends from getting shot. He was a hero at 15. What's our excuse for not acting? https://t.co/hn98uGsjKZ,20477,14540,"{'hashtags': [], 'symbols': [], 'user_mentions': [], 'urls': [{'url': 'https://t.co/hn98uGsjKZ', 'expanded_url': 'http://wpo.st/05Vy0', 'display_url': 'wpo.st/05Vy0', 'indices': [115, 138]}]}",en
677991253259264000,2015-12-18 23:18:05,RT @NASA: .@NASA_Hubble found what looks like a cosmic lightsaber in our Milky Way galaxy: https://t.co/vVBSVTpH2L #StarWars https://t.co/P…,0,4689,"{'hashtags': [{'text': 'StarWars', 'indices': [115, 124]}], 'symbols': [], 'user_mentions': [{'screen_name': 'NASA', 'name': 'NASA', 'id': 11348282, 'id_str': '11348282', 'indices': [3, 8]}, {'screen_name': 'NASA_Hubble', 'name': 'NASA Hubble', 'id': 845297127362322432, 'id_str': '845297127362322432', 'indices': [11, 23]}], 'urls': [{'url': 'https://t.co/vVBSVTpH2L', 'expanded_url': 'http://go.nasa.gov/1PbjXic', 'display_url': 'go.nasa.gov/1PbjXic', 'indices': [91, 114]}]}",en
