id,created_at,text,favorites,retweets,entities,language
634413305516412928,2015-08-20 17:14:53,"President Carter is as good a man as they come. Michelle and I are praying for him and Rosalynn. We're all pulling for you, Jimmy.",14880,5502,"{'hashtags': [], 'symbols': [], 'user_mentions': [], 'urls': []}",en
632212730209009664,2015-08-14 15:30:35,"Due to popular request, here are my vacation playlists: http://t.co/uer5sIl4Vk http://t.co/zHEekHvQBr What's your favorite summer song?",12463,7174,"{'hashtags': [], 'symbols': [], 'user_mentions': [], 'urls': [{'url': 'http://t.co/uer5sIl4Vk', 'expanded_url': 'http://spoti.fi/potusplaylist1', 'display_url': 'spoti.fi/potusplaylist1', 'indices': [56, 78]}, {'url': 'http://t.co/zHEekHvQBr', 'expanded_url': 'http://spoti.fi/potusplaylist2', 'display_url': 'spoti.fi/potusplaylist2', 'indices': [79, 101]}]}",en
632209808930828288,2015-08-14 15:18:58,"RT @JohnKerry: Pleased to be in #Havana for historic day @USEmbCuba. Incredible: last time #SecState visited #Cuba, FDR was @POTUS. http://…",0,2475,"{'hashtags': [{'text': 'Havana', 'indices': [32, 39]}, {'text': 'SecState', 'indices': [91, 100]}, {'text': 'Cuba', 'indices': [109, 114]}], 'symbols': [], 'user_mentions': [{'screen_name': 'JohnKerry', 'name': 'John Kerry', 'id': 15007149, 'id_str': '15007149', 'indices': [3, 13]}, {'screen_name': 'USEmbCuba', 'name': 'Embajada de los Estados Unidos en Cuba', 'id': 133769083, 'id_str': '133769083', 'indices': [57, 67]}, {'screen_name': 'POTUS', 'name': 'President Trump', 'id': 822215679726100480, 'id_str': '822215679726100480', 'indices': [124, 130]}], 'urls': []}",en
629343799299411969,2015-08-06 17:30:29,Thank you for all you've done to protect our sacred right to vote. It's as important today as it's ever been. https://t.co/ge74wu5nc1,3856,1619,"{'hashtags': [], 'symbols': [], 'user_mentions': [], 'urls': [{'url': 'https://t.co/ge74wu5nc1', 'expanded_url': 'https://twitter.com/repjohnlewis/status/629343428925636609', 'display_url': 'twitter.com/repjohnlewis/s…', 'indices': [110, 133]}]}",en
629342681962049538,2015-08-06 17:26:02,"Heroes like @RepJohnLewis, Dr. King, and countless others sacrificed so that all of our voices could be heard. http://t.co/L7kxtWQlYW",8188,4416,"{'hashtags': [], 'symbols': [], 'user_mentions': [{'screen_name': 'repjohnlewis', 'name': 'John Lewis', 'id': 29450962, 'id_str': '29450962', 'indices': [12, 25]}], 'urls': [], 'media': [{'id': 629342657429569536, 'id_str': '629342657429569536', 'indices': [111, 133], 'media_url': 'http://pbs.twimg.com/media/CLvf0AIXAAAiLNM.jpg', 'media_url_https': 'https://pbs.twimg.com/media/CLvf0AIXAAAiLNM.jpg', 'url': 'http://t.co/L7kxtWQlYW', 'display_url': 'pic.twitter.com/L7kxtWQlYW', 'expanded_url': 'https://twitter.com/POTUS/status/629342681962049538/photo/1', 'type': 'photo', 'sizes': {'large': {'w': 1024, 'h': 502, 'resize': 'fit'}, 'small': {'w': 680, 'h': 333, 'resize': 'fit'}, 'thumb': {'w': 150, 'h': 150, 'resize': 'crop'}, 'medium': {'w': 1024, 'h': 502, 'resize': 'fit'}}}]}",en
629342056876503040,2015-08-06 17:23:33,"Before 1965, African Americans faced poll taxes, literacy tests, or having to count jellybeans in a jar when they tried to register to vote.",6432,4342,"{'hashtags': [], 'symbols': [], 'user_mentions': [], 'urls': []}",en
629341526439653377,2015-08-06 17:21:27,"50 years ago today, President Johnson signed the Voting Rights Act into law, securing the right to vote for millions of African Americans.",11120,6099,"{'hashtags': [], 'symbols': [], 'user_mentions': [], 'urls': []}",en
629064761188184064,2015-08-05 23:01:41,Pretty incredible time lapse of the dark side of the moon passing Earth from @NASA. American ingenuity at work! http://t.co/JKep9bcxGQ,10785,6680,"{'hashtags': [], 'symbols': [], 'user_mentions': [{'screen_name': 'NASA', 'name': 'NASA', 'id': 11348282, 'id_str': '11348282', 'indices': [77, 82]}], 'urls': [], 'media': [{'id': 629064721891766272, 'id_str': '629064721891766272', 'indices': [112, 134], 'media_url': 'http://pbs.twimg.com/ext_tw_video_thumb/629064721891766272/pu/img/JVUKrM9Uo3LvGCSN.jpg', 'media_url_https': 'https://pbs.twimg.com/ext_tw_video_thumb/629064721891766272/pu/img/JVUKrM9Uo3LvGCSN.jpg', 'url': 'http://t.co/JKep9bcxGQ', 'display_url': 'pic.twitter.com/JKep9bcxGQ', 'expanded_url': 'https://twitter.com/POTUS/status/629064761188184064/video/1', 'type': 'photo', 'sizes': {'thumb': {'w': 150, 'h': 150, 'resize': 'crop'}, 'medium': {'w': 1200, 'h': 675, 'resize': 'fit'}, 'small': {'w': 680, 'h': 383, 'resize': 'fit'}, 'large': {'w': 1280, 'h': 720, 'resize': 'fit'}}}]}",en
629030795299147776,2015-08-05 20:46:43,Important detail – there are no secret deals. My staff can brief you on any question about any part of the deal. https://t.co/UO0B5xCOPh,5124,2364,"{'hashtags': [], 'symbols': [], 'user_mentions': [], 'urls': [{'url': 'https://t.co/UO0B5xCOPh', 'expanded_url': 'https://twitter.com/stevescalise/status/628971521663475712', 'display_url': 'twitter.com/stevescalise/s…', 'indices': [113, 136]}]}",en
629030461449338881,2015-08-05 20:45:23,The choice is ultimately between diplomacy and war. Iran's nuclear program accelerates if Congress kills this deal. https://t.co/nvBeO1Omko,3070,1596,"{'hashtags': [], 'symbols': [], 'user_mentions': [], 'urls': [{'url': 'https://t.co/nvBeO1Omko', 'expanded_url': 'https://twitter.com/senatemajldr/status/628946892236451840', 'display_url': 'twitter.com/senatemajldr/s…', 'indices': [116, 139]}]}",en
629028301454094336,2015-08-05 20:36:48,"It's the strongest nuclear deal ever negotiated. There's no such thing as a ""better deal."" Walking away risks war. https://t.co/la7GhQXfzl",3236,1681,"{'hashtags': [], 'symbols': [], 'user_mentions': [], 'urls': [{'url': 'https://t.co/la7GhQXfzl', 'expanded_url': 'https://twitter.com/angelakkmiller/status/628944989406556160', 'display_url': 'twitter.com/angelakkmiller…', 'indices': [115, 138]}]}",en
628286472781754368,2015-08-03 19:29:02,I refuse to condemn our kids to a planet that's beyond fixing. Let's meet this challenge and #ActOnClimate together.,13759,7500,"{'hashtags': [{'text': 'ActOnClimate', 'indices': [93, 106]}], 'symbols': [], 'user_mentions': [], 'urls': []}",en
628285077970153472,2015-08-03 19:23:30,"Despite what the critics will tell you, this plan will ultimately save the average American family nearly $85 a year on their energy bills.",5565,2087,"{'hashtags': [], 'symbols': [], 'user_mentions': [], 'urls': []}",en
628283831104237569,2015-08-03 19:18:32,"Thanks to this plan, there will be 90,000 fewer asthma attacks among our kids and we'll avoid 3,600 premature deaths in 2030.",4423,2230,"{'hashtags': [], 'symbols': [], 'user_mentions': [], 'urls': []}",en
628283044772868097,2015-08-03 19:15:25,"It's time to change that. With the Clean Power Plan, by 2030, carbon pollution from power plants will be 32% lower than it was a decade ago.",4194,2590,"{'hashtags': [], 'symbols': [], 'user_mentions': [], 'urls': []}",en
628282174869999616,2015-08-03 19:11:58,"Right now, power plants account for about one-third of America’s carbon pollution. That’s more than our cars, airplanes, and homes combined.",3104,2137,"{'hashtags': [], 'symbols': [], 'user_mentions': [], 'urls': []}",en
628280902817304578,2015-08-03 19:06:54,"Levels of carbon dioxide in our atmosphere are higher than they’ve been in 800,000 years. 2014 was the planet’s warmest year on record.",4066,3424,"{'hashtags': [], 'symbols': [], 'user_mentions': [], 'urls': []}",en
628280710017720321,2015-08-03 19:06:08,"Today, we're announcing America's Clean Power Plan—the most important step we've ever taken to combat climate change. Here are the facts:",10641,4571,"{'hashtags': [], 'symbols': [], 'user_mentions': [], 'urls': []}",en
627560699347255297,2015-08-01 19:25:04,"Hey @StationCDRKelly, loving the photos. Do you ever look out the window and just freak out?",10345,3386,"{'hashtags': [], 'symbols': [], 'user_mentions': [{'screen_name': 'StationCDRKelly', 'name': 'Scott Kelly', 'id': 65647594, 'id_str': '65647594', 'indices': [4, 20]}], 'urls': []}",en
627211041466941441,2015-07-31 20:15:39,"Launching a pilot program to help students in prison pay for college, because everyone willing to work for it deserves a second chance.",16851,6844,"{'hashtags': [], 'symbols': [], 'user_mentions': [], 'urls': []}",en
626794365869010945,2015-07-30 16:39:56,"Happy 50th birthday, Medicare and Medicaid! Two programs, one promise: that every American deserves a basic measure of dignity and security.",7266,2969,"{'hashtags': [], 'symbols': [], 'user_mentions': [], 'urls': []}",en
625411767414444032,2015-07-26 21:05:59,"25 years of the ADA and Americans with disabilities are breaking more barriers than ever, making all of us more free. Let's keep going.",5884,2657,"{'hashtags': [], 'symbols': [], 'user_mentions': [], 'urls': []}",en
624691954224365568,2015-07-24 21:25:42,"Proud to be the first American President to visit Kenya. Happy to see family, and to talk with young Kenyans about the future.",28515,17176,"{'hashtags': [], 'symbols': [], 'user_mentions': [], 'urls': []}",en
623661992952377344,2015-07-22 01:13:00,"E.L. Doctorow was one of America's greatest novelists. His books taught me much, and he will be missed.",3710,1600,"{'hashtags': [], 'symbols': [], 'user_mentions': [], 'urls': []}",en
623502798366351360,2015-07-21 14:40:25,RT @TheIranDeal: The historic #IranDeal succeeds in verifying that Iran cannot obtain a nuclear weapon. Follow to get the facts: http://t.c…,0,1146,"{'hashtags': [{'text': 'IranDeal', 'indices': [30, 39]}], 'symbols': [], 'user_mentions': [{'screen_name': 'TheIranDeal', 'name': 'The Iran Deal (NARA)', 'id': 3281853858, 'id_str': '3281853858', 'indices': [3, 15]}], 'urls': []}",en
623137065341952000,2015-07-20 14:27:08,Just got this new blue marble photo from @NASA. A beautiful reminder that we need to protect the only planet we have. http://t.co/JQ3174P0LF,29921,18170,"{'hashtags': [], 'symbols': [], 'user_mentions': [{'screen_name': 'NASA', 'name': 'NASA', 'id': 11348282, 'id_str': '11348282', 'indices': [41, 46]}], 'urls': [], 'media': [{'id': 623137059323125760, 'id_str': '623137059323125760', 'indices': [118, 140], 'media_url': 'http://pbs.twimg.com/media/CKXT2ptWIAAQ6lk.jpg', 'media_url_https': 'https://pbs.twimg.com/media/CKXT2ptWIAAQ6lk.jpg', 'url': 'http://t.co/JQ3174P0LF', 'display_url': 'pic.twitter.com/JQ3174P0LF', 'expanded_url': 'https://twitter.com/POTUS/status/623137065341952000/photo/1', 'type': 'photo', 'sizes': {'thumb': {'w': 150, 'h': 150, 'resize': 'crop'}, 'small': {'w': 680, 'h': 680, 'resize': 'fit'}, 'medium': {'w': 1024, 'h': 1024, 'resize': 'fit'}, 'large': {'w': 1024, 'h': 1024, 'resize': 'fit'}}}]}",en
622147491862028289,2015-07-17 20:54:55,Had a great visit today with Emma Didlake - our oldest living veteran at 110-years-young! She's a true American hero. http://t.co/EeeIC3AK4A,15849,5120,"{'hashtags': [], 'symbols': [], 'user_mentions': [], 'urls': [], 'media': [{'id': 622147411276730368, 'id_str': '622147411276730368', 'indices': [118, 140], 'media_url': 'http://pbs.twimg.com/media/CKJPxjcUEAAy7Kl.jpg', 'media_url_https': 'https://pbs.twimg.com/media/CKJPxjcUEAAy7Kl.jpg', 'url': 'http://t.co/EeeIC3AK4A', 'display_url': 'pic.twitter.com/EeeIC3AK4A', 'expanded_url': 'https://twitter.com/POTUS/status/622147491862028289/photo/1', 'type': 'photo', 'sizes': {'thumb': {'w': 150, 'h': 150, 'resize': 'crop'}, 'large': {'w': 682, 'h': 1024, 'resize': 'fit'}, 'small': {'w': 453, 'h': 680, 'resize': 'fit'}, 'medium': {'w': 682, 'h': 1024, 'resize': 'fit'}}}]}",en
622091025541136384,2015-07-17 17:10:33,Congrats to Oregon on passing two years of free community college! Every hardworking student deserves access to higher education.,35090,20114,"{'hashtags': [], 'symbols': [], 'user_mentions': [], 'urls': []}",en
621133763385425920,2015-07-15 01:46:43,Pluto just had its first visitor! Thanks @NASA - it's a great day for discovery and American leadership. http://t.co/FfztBSMbK0,33470,17158,"{'hashtags': [], 'symbols': [], 'user_mentions': [{'screen_name': 'NASA', 'name': 'NASA', 'id': 11348282, 'id_str': '11348282', 'indices': [41, 46]}], 'urls': [], 'media': [{'id': 621133727779819520, 'id_str': '621133727779819520', 'indices': [105, 127], 'media_url': 'http://pbs.twimg.com/media/CJ611aJUkAAGaqP.jpg', 'media_url_https': 'https://pbs.twimg.com/media/CJ611aJUkAAGaqP.jpg', 'url': 'http://t.co/FfztBSMbK0', 'display_url': 'pic.twitter.com/FfztBSMbK0', 'expanded_url': 'https://twitter.com/POTUS/status/621133763385425920/photo/1', 'type': 'photo', 'sizes': {'small': {'w': 640, 'h': 640, 'resize': 'fit'}, 'thumb': {'w': 150, 'h': 150, 'resize': 'crop'}, 'large': {'w': 640, 'h': 640, 'resize': 'fit'}, 'medium': {'w': 640, 'h': 640, 'resize': 'fit'}}}]}",en
621121462649397249,2015-07-15 00:57:51,Good conversation with Tom Friedman on the deal we reached with Iran. It's a major step toward a safer world.  https://t.co/xwSrH9IoFG,2750,1220,"{'hashtags': [], 'symbols': [], 'user_mentions': [], 'urls': [{'url': 'https://t.co/xwSrH9IoFG', 'expanded_url': 'https://twitter.com/tomfriedman/status/621084602644471810', 'display_url': 'twitter.com/tomfriedman/st…', 'indices': [111, 134]}]}",en
621088588583800832,2015-07-14 22:47:13,Mass incarceration doesn't work. Let's build communities that give kids a shot at success and prisons that prepare people for a 2nd chance.,27202,21966,"{'hashtags': [], 'symbols': [], 'user_mentions': [], 'urls': []}",en
621087343253057541,2015-07-14 22:42:16,We could eliminate tuition at every public college and university in America with the $80 billion we spend each year on incarcerations.,74949,83617,"{'hashtags': [], 'symbols': [], 'user_mentions': [], 'urls': []}",en
621086198254145536,2015-07-14 22:37:43,The $80 billion we spend each year on incarcerations could double the salary of every high school teacher in America.,17051,17142,"{'hashtags': [], 'symbols': [], 'user_mentions': [], 'urls': []}",en
621085397007888384,2015-07-14 22:34:32,The $80 billion we spend each year to keep people incarcerated could pay for universal pre-K for every 3-year-old and 4-year-old in America.,11889,12399,"{'hashtags': [], 'symbols': [], 'user_mentions': [], 'urls': []}",en
621084469970214914,2015-07-14 22:30:51,"In 1980, there were 500,000 people in American jails. Today, there are 2.2 million. Many belong. But too many are nonviolent offenders.",10730,9984,"{'hashtags': [], 'symbols': [], 'user_mentions': [], 'urls': []}",en
621083313063763968,2015-07-14 22:26:15,America keeps more people behind bars than the top 35 European countries combined.,8639,9544,"{'hashtags': [], 'symbols': [], 'user_mentions': [], 'urls': []}",en
621081946236563456,2015-07-14 22:20:49,"America is home to 5% of the world's population, but 25% of the world's prisoners.",10449,11591,"{'hashtags': [], 'symbols': [], 'user_mentions': [], 'urls': []}",en
621081548029345792,2015-07-14 22:19:14,"Just spoke to the NAACP about criminal justice reform, something many broadly agree on. Some stats:",5155,2423,"{'hashtags': [], 'symbols': [], 'user_mentions': [], 'urls': []}",en
619509587272691712,2015-07-10 14:12:50,"South Carolina taking down the confederate flag - a signal of good will and healing, and a meaningful step towards a better future.",28357,17103,"{'hashtags': [], 'symbols': [], 'user_mentions': [], 'urls': []}",en
617860799953010688,2015-07-06 01:01:08,What a win for Team USA! Great game @CarliLloyd! Your country is so proud of all of you. Come visit the White House with the World Cup soon.,51038,24207,"{'hashtags': [], 'symbols': [], 'user_mentions': [{'screen_name': 'CarliLloyd', 'name': 'Carli Lloyd', 'id': 110195330, 'id_str': '110195330', 'indices': [36, 47]}], 'urls': []}",en
617542692952764417,2015-07-05 03:57:06,http://t.co/Ft3DwYWRJv,21358,4549,"{'hashtags': [], 'symbols': [], 'user_mentions': [], 'urls': [], 'media': [{'id': 617542690343886848, 'id_str': '617542690343886848', 'indices': [0, 22], 'media_url': 'http://pbs.twimg.com/media/CJHzzhOWIAAWQNk.jpg', 'media_url_https': 'https://pbs.twimg.com/media/CJHzzhOWIAAWQNk.jpg', 'url': 'http://t.co/Ft3DwYWRJv', 'display_url': 'pic.twitter.com/Ft3DwYWRJv', 'expanded_url': 'https://twitter.com/POTUS/status/617542692952764417/photo/1', 'type': 'photo', 'sizes': {'thumb': {'w': 150, 'h': 150, 'resize': 'crop'}, 'medium': {'w': 640, 'h': 458, 'resize': 'fit'}, 'small': {'w': 640, 'h': 458, 'resize': 'fit'}, 'large': {'w': 640, 'h': 458, 'resize': 'fit'}}}]}",und
617430014422843392,2015-07-04 20:29:21,"It doesn't get much better than celebrating America with the people you love. Happy Fourth of July, everyone!",25647,7971,"{'hashtags': [], 'symbols': [], 'user_mentions': [], 'urls': []}",en
616441802023960576,2015-07-02 03:02:33,It's not mine; just a loaner. Maybe you can come play at the White House sometime instead?  https://t.co/srZKB6plzz,27125,10871,"{'hashtags': [], 'symbols': [], 'user_mentions': [], 'urls': [{'url': 'https://t.co/srZKB6plzz', 'expanded_url': 'https://twitter.com/theblackkeys/status/616364682895564800', 'display_url': 'twitter.com/theblackkeys/s…', 'indices': [92, 115]}]}",en
616418071683665920,2015-07-02 01:28:15,"RT @hotelkeys: @POTUS 
23yrold recent grad has full-time job but no insurance. Peace of mind that she can be on our plan. #ACAWorks",0,348,"{'hashtags': [{'text': 'ACAWorks', 'indices': [122, 131]}], 'symbols': [], 'user_mentions': [{'screen_name': 'hotelkeys', 'name': 'Connie C. Keys', 'id': 100005598, 'id_str': '100005598', 'indices': [3, 13]}, {'screen_name': 'POTUS', 'name': 'President Trump', 'id': 822215679726100480, 'id_str': '822215679726100480', 'indices': [15, 21]}], 'urls': []}",en
616417443246907392,2015-07-02 01:25:45,"RT @crazywritinfool: @POTUS #ACAWorks because I could switch insurance providers to get a lower rate. Couldn't before due to ""preexisting c…",0,357,"{'hashtags': [{'text': 'ACAWorks', 'indices': [28, 37]}], 'symbols': [], 'user_mentions': [{'screen_name': 'crazywritinfool', 'name': 'crazywritinfool', 'id': 7713582, 'id_str': '7713582', 'indices': [3, 19]}, {'screen_name': 'POTUS', 'name': 'President Trump', 'id': 822215679726100480, 'id_str': '822215679726100480', 'indices': [21, 27]}], 'urls': []}",en
616416358096572416,2015-07-02 01:21:26,RT @NotoriousLLT: Sister is legally blind &amp; on disability b/c of glaucoma. She needs care to keep sight she has left. With #ACA she can aff…,0,413,"{'hashtags': [{'text': 'ACA', 'indices': [127, 131]}], 'symbols': [], 'user_mentions': [{'screen_name': 'NotoriousLLT', 'name': 'The_Notorious_PhD', 'id': 1016746238, 'id_str': '1016746238', 'indices': [3, 16]}], 'urls': []}",en
616340901351264256,2015-07-01 20:21:36,"Gotta go, but this was fun. Let's keep the health care conversation going - share how the #ACAWorks for you or your family.",4502,789,"{'hashtags': [{'text': 'ACAWorks', 'indices': [90, 99]}], 'symbols': [], 'user_mentions': [], 'urls': []}",en
616339969125302276,2015-07-01 20:17:54,butler's a great player on o and d; let's sign him up long term. go bulls! https://t.co/IqbyUmcbmJ,4664,3053,"{'hashtags': [], 'symbols': [], 'user_mentions': [], 'urls': [{'url': 'https://t.co/IqbyUmcbmJ', 'expanded_url': 'https://twitter.com/Matt_Rodewald/status/616313502932844544', 'display_url': 'twitter.com/Matt_Rodewald/…', 'indices': [75, 98]}]}",en
616339733132804096,2015-07-01 20:16:58,"people lack info/turned off by political noise. w court case done, let's focus on getting people signed up. https://t.co/vFCDgMXSE9",2225,729,"{'hashtags': [], 'symbols': [], 'user_mentions': [], 'urls': [{'url': 'https://t.co/vFCDgMXSE9', 'expanded_url': 'https://twitter.com/jayrocky_vs/status/616312088282140673', 'display_url': 'twitter.com/jayrocky_vs/st…', 'indices': [108, 131]}]}",en
616338933962670080,2015-07-01 20:13:47,pushing to make 2 yrs comm college free; permit refinancing on student loans; push colleges to keep tuition low https://t.co/dTbTNDQSII,13231,8856,"{'hashtags': [], 'symbols': [], 'user_mentions': [], 'urls': [{'url': 'https://t.co/dTbTNDQSII', 'expanded_url': 'https://twitter.com/ryann1232/status/616329450129608704', 'display_url': 'twitter.com/ryann1232/stat…', 'indices': [112, 135]}]}",en
616338528138608640,2015-07-01 20:12:10,"respect the nyt, but not buying peas in guac. onions, garlic, hot peppers. classic. https://t.co/MEEI8QHH1V",19034,12856,"{'hashtags': [], 'symbols': [], 'user_mentions': [], 'urls': [{'url': 'https://t.co/MEEI8QHH1V', 'expanded_url': 'https://twitter.com/JGreenDC/status/616311940957253632', 'display_url': 'twitter.com/JGreenDC/statu…', 'indices': [84, 107]}]}",en
616338019843461121,2015-07-01 20:10:09,was listening to outkast/liberation and the black keys/lonely boy this morning. https://t.co/1DP6CRdwlm,32013,19213,"{'hashtags': [], 'symbols': [], 'user_mentions': [], 'urls': [{'url': 'https://t.co/1DP6CRdwlm', 'expanded_url': 'https://twitter.com/theonIyreasn/status/616329416155607040', 'display_url': 'twitter.com/theonIyreasn/s…', 'indices': [80, 103]}]}",en
616337692582899712,2015-07-01 20:08:51,there's a hardship exemption; fine only applies to folks who can afford insurance but choose not to. https://t.co/XWFEKbZCaT,2302,970,"{'hashtags': [], 'symbols': [], 'user_mentions': [], 'urls': [{'url': 'https://t.co/XWFEKbZCaT', 'expanded_url': 'https://twitter.com/christinaloucks/status/616314593363648516', 'display_url': 'twitter.com/christinalouck…', 'indices': [101, 124]}]}",en
616337090767405056,2015-07-01 20:06:28,"have principles and issues you are passionate about, and act; worry more about doing something than being something. https://t.co/QqbgflhXDY",6517,3226,"{'hashtags': [], 'symbols': [], 'user_mentions': [], 'urls': [{'url': 'https://t.co/QqbgflhXDY', 'expanded_url': 'https://twitter.com/fieldemma47/status/616335592914206721', 'display_url': 'twitter.com/fieldemma47/st…', 'indices': [117, 140]}]}",en
616336742854078464,2015-07-01 20:05:05,EX-IM bank helps US companies export; that means good paying american jobs. optimistic that congress gets it done. https://t.co/UeBhgiL64B,747,315,"{'hashtags': [], 'symbols': [], 'user_mentions': [], 'urls': [{'url': 'https://t.co/UeBhgiL64B', 'expanded_url': 'https://twitter.com/SableSys/status/616324400091037696', 'display_url': 'twitter.com/SableSys/statu…', 'indices': [115, 138]}]}",en
616336192443916289,2015-07-01 20:02:53,now's time to encourage states that held off for political reasons to do the right thing; contact state officials! https://t.co/QqUY3S9MoC,1229,514,"{'hashtags': [], 'symbols': [], 'user_mentions': [], 'urls': [{'url': 'https://t.co/QqUY3S9MoC', 'expanded_url': 'https://twitter.com/katrobison/status/616328255344394241', 'display_url': 'twitter.com/katrobison/sta…', 'indices': [115, 138]}]}",en
616335694928199680,2015-07-01 20:00:55,congratulations! hope you guys are getting sleep. nothing beats babies! https://t.co/ymGM0HARad,3538,642,"{'hashtags': [], 'symbols': [], 'user_mentions': [], 'urls': [{'url': 'https://t.co/ymGM0HARad', 'expanded_url': 'https://twitter.com/nathan210/status/616324467296477184', 'display_url': 'twitter.com/nathan210/stat…', 'indices': [72, 95]}]}",en
616335347174232064,2015-07-01 19:59:32,"not true - like last year, insurers request premium hikes, but must be approved; expect final increases to be less   https://t.co/WfJI2AOLkP",1087,452,"{'hashtags': [], 'symbols': [], 'user_mentions': [], 'urls': [{'url': 'https://t.co/WfJI2AOLkP', 'expanded_url': 'https://twitter.com/RaulieGonzo/status/616323201480720384', 'display_url': 'twitter.com/RaulieGonzo/st…', 'indices': [117, 140]}]}",en
616334401157378048,2015-07-01 19:55:46,we need to encourage states to take advantage of medicaid expansion; could insure 4 mil more people in 22 states! https://t.co/S9RlkVB1An,1470,678,"{'hashtags': [], 'symbols': [], 'user_mentions': [], 'urls': [{'url': 'https://t.co/S9RlkVB1An', 'expanded_url': 'https://twitter.com/TheRealDylanG/status/616313067362586624', 'display_url': 'twitter.com/TheRealDylanG/…', 'indices': [114, 137]}]}",en
616334258697859073,2015-07-01 19:55:12,"Alright, let's do this. Ready to answer your health care questions. Keep 'em coming with #AskPOTUS. http://t.co/wK8RDF2H0i",6419,1933,"{'hashtags': [{'text': 'AskPOTUS', 'indices': [89, 98]}], 'symbols': [], 'user_mentions': [], 'urls': [], 'media': [{'id': 616334241912107008, 'id_str': '616334241912107008', 'indices': [100, 122], 'media_url': 'http://pbs.twimg.com/media/CI2oukAUsAA0GJG.jpg', 'media_url_https': 'https://pbs.twimg.com/media/CI2oukAUsAA0GJG.jpg', 'url': 'http://t.co/wK8RDF2H0i', 'display_url': 'pic.twitter.com/wK8RDF2H0i', 'expanded_url': 'https://twitter.com/POTUS/status/616334258697859073/photo/1', 'type': 'photo', 'sizes': {'thumb': {'w': 150, 'h': 150, 'resize': 'crop'}, 'small': {'w': 510, 'h': 680, 'resize': 'fit'}, 'large': {'w': 768, 'h': 1024, 'resize': 'fit'}, 'medium': {'w': 768, 'h': 1024, 'resize': 'fit'}}}]}",en
616311028847112192,2015-07-01 18:22:54,Hello from Nashville! I'll be answering your questions on health care and the Affordable Care Act at 3:30pm ET. Tweet yours using #AskPOTUS.,2422,990,"{'hashtags': [{'text': 'AskPOTUS', 'indices': [130, 139]}], 'symbols': [], 'user_mentions': [], 'urls': []}",en
616057454430957572,2015-07-01 01:35:17,Congrats to the #USWNT! Can't wait for the finals. You make us all proud!,22075,9038,"{'hashtags': [{'text': 'USWNT', 'indices': [16, 22]}], 'symbols': [], 'user_mentions': [], 'urls': []}",en
